{
  "format": "binary-generator-v1",
  "q": 2,
  "n": 44,
  "k": 10,
  "d": 15,
  "rows": [
    "10100000011001000100111010001110000001010010",
    "01000000010110010011101001011110010000010110",
    "00100000011101000000000110111011001000101111",
    "00010000010111101101001101010110001101100100",
    "00001010001111111110001110101001111000101011",
    "00000100010000011000011010000110101101011001",
    "00000010011001011110110111000011111011001110",
    "00000001000010101110011111111010011000110001",
    "00000000110000100001110010011010011111110000",
    "00000000001011000111011000111010100101101001"
  ],
  "provenance": {
    "kind": "local-search",
    "seed": "b17a20261020c0de0000000000000001",
    "restart": 2,
    "iterations": 1000,
    "initial": "random systematic",
    "method": "lexicographic weight-spectrum hill climb; column and bit mutations"
  }
}
