{
  "format": "binary-generator-v1",
  "q": 2,
  "n": 52,
  "k": 10,
  "d": 16,
  "rows": [
    "1000000000001011101000001100010001011000011000110000",
    "0100000000000011011111101101110111000010100111111010",
    "0010000000101011101111010101111110010010010010101000",
    "0001000000000011110111011011010110000101111001000000",
    "0000100000100111001100000101101001111100100000001111",
    "0000010100100001111101000100001111000010001101010011",
    "0000001000000011110111110010011011101111100011010001",
    "0000000100011111111111000010001001001010000100101110",
    "0000000010100100000111111011100110011101111111010111",
    "0000000001000100011100000110011010010110101001010001"
  ],
  "provenance": {
    "kind": "search-milestone",
    "run": "52_10_cold_901_blind",
    "step": 5
  }
}
