{
  "format": "binary-generator-v1",
  "q": 2,
  "n": 44,
  "k": 11,
  "d": 15,
  "rows": [
    "10000000000010100111000111010000111110111001",
    "01000000000001010011101011101000011111011100",
    "00100000000000101001110101110100001111101110",
    "00010000000100010100110010111010000111110111",
    "00001000000110001010010001011101010011111011",
    "00000100000111000101000000101110111001111101",
    "00000010000011100010101000010111011100111110",
    "00000001000001110001010100001011101110011111",
    "00000000100100111000101010000101110111001111",
    "00000000010010011100011101000010111011100111",
    "00000000001101001110001110100001011101110011"
  ],
  "provenance": {
    "kind": "structured-search-milestone",
    "run": "44_11_202_random",
    "phase": "qc",
    "step": 71,
    "log": "research/c0202026102018570000000000000001/qc/44_11_202_random.jsonl"
  }
}
