{
  "format": "binary-generator-v1",
  "q": 2,
  "n": 61,
  "k": 11,
  "d": 24,
  "rows": [
    "1101010011011010000111010011010100010111001101010100110110011",
    "1101010011010001111101100001101101110100101111111001101100110",
    "1101010011000110001000000100011110110011101010100011011001100",
    "1101010011101001100011001111111000111101100000010110110011000",
    "1101010010110110110101011000110100100001110101111101100110000",
    "1101010000001000011001110110101100011001011110101011001100000",
    "1101010101110101000000101010011101101000001000000110011000000",
    "1101011110001111110010010011111110001010100101011100110000000",
    "1101001001111010010111100000111001001111111111101001100000000",
    "1101100110010001011100000110110111000101001010000011000000000",
    "1100111001000111001011001010101011010000100001010110000000000"
  ],
  "provenance": {
    "kind": "published-reconstruction",
    "url": "https://www.codetables.de/BKLC/BKLC.php?q=2&n=61&k=11",
    "snapshot": "data/sources/61_11.html",
    "snapshot_sha256": "47bb6a05a300ab6e5dbc7cd5a9468b605af2eb5fe0bacb0665dcd031b3808486",
    "steps": [
      {
        "index": 1,
        "n": 64,
        "k": 16,
        "published_d": 24,
        "verified_d": 24,
        "recipe": "Extended BCHCode with parameters 63 23"
      },
      {
        "index": 2,
        "n": 61,
        "k": 13,
        "published_d": 24,
        "verified_d": 24,
        "recipe": "Shortening of [1] at { 62 .. 64 }"
      },
      {
        "index": 3,
        "n": 61,
        "k": 11,
        "published_d": 24,
        "verified_d": 24,
        "recipe": "Subcode of [2]"
      }
    ],
    "credit": "Published construction, not a pilot discovery. Named authors retained in recipe text."
  }
}
