{
  "format": "binary-generator-v1",
  "q": 2,
  "n": 52,
  "k": 10,
  "d": 21,
  "rows": [
    "1000000011011101010110101111010110100111110010101111",
    "0010000010010001101010111101010100100100010101001010",
    "0000100001001001010010001010101010010110111011010100",
    "0100000011101101011010100100001010100001100101011000",
    "0101000001100100001110100001101111101100011000110000",
    "1100100001111001011111111110001001101111011100100000",
    "0001010011001100011110010100110111110010110011000000",
    "0000101001101101111000100010111111001111000110000000",
    "1111111000000011111110000000111111111111111000000000",
    "1111111111111100000000000000111111100000000000000000"
  ],
  "provenance": {
    "kind": "published-reconstruction",
    "url": "https://www.codetables.de/BKLC/BKLC.php?q=2&n=52&k=10",
    "snapshot": "data/sources/52_10.html",
    "snapshot_sha256": "7a4ecccb3caabe31d670bb043301854604be84b0a54be858cfc6ff218a48676c",
    "steps": [
      {
        "index": 1,
        "n": 53,
        "k": 10,
        "published_d": 22,
        "verified_d": 22,
        "recipe": "Construction from a stored generator matrix:\n\n[ 1, 0, 0, 0, 0, 0, 0, 0, 1, 1, 0, 1, 1, 1, 0, 1, 0, 1, 0, 1, 1, 0, 1, 0, 1, 1, 1, 1, 0, 1, 0, 1, 1, 0, 1, 0, 0, 1, 1, 1, 1, 1, 0, 0, 1, 0, 1, 0, 1, 1, 1, 1, 0 ]\n[ 0, 1, 0, 0, 0, 0, 0, 0, 1, 1, 1, 0, 1, 1, 0, 1, 0, 1, 1, 0, 1, 0, 1, 0, 0, 1, 0, 0, 0, 0, 1, 0, 1, 0, 1, 0, 0, 0, 0, 1, 1, 0, 0, 1, 0, 1, 0, 1, 1, 0, 0, 0, 1 ]\n[ 0, 0, 1, 0, 0, 0, 0, 0, 1, 0, 0, 1, 0, 0, 0, 1, 1, 0, 1, 0, 1, 0, 1, 1, 1, 1, 0, 1, 0, 1, 0, 1, 0, 0, 1, 0, 0, 1, 0, 0, 0, 1, 0, 1, 0, 1, 0, 0, 1, 0, 1, 0, 1 ]\n[ 0, 0, 0, 1, 0, 0, 0, 0, 1, 0, 0, 0, 1, 0, 0, 1, 0, 1, 0, 1, 0, 0, 0, 0, 0, 1, 0, 1, 1, 0, 0, 1, 0, 1, 0, 0, 1, 1, 0, 1, 1, 1, 1, 1, 0, 1, 1, 0, 1, 0, 0, 0, 1 ]\n[ 0, 0, 0, 0, 1, 0, 0, 0, 0, 1, 0, 0, 1, 0, 0, 1, 0, 1, 0, 0, 1, 0, 0, 0, 1, 0, 1, 0, 1, 0, 1, 0, 1, 0, 0, 1, 0, 1, 1, 0, 1, 1, 1, 0, 1, 1, 0, 1, 0, 1, 0, 0, 1 ]\n[ 0, 0, 0, 0, 0, 1, 0, 0, 0, 1, 0, 0, 0, 1, 0, 1, 0, 0, 1, 0, 1, 0, 0, 1, 0, 0, 0, 1, 0, 1, 0, 0, 1, 0, 1, 1, 1, 1, 1, 1, 0, 0, 1, 1, 1, 0, 1, 0, 1, 0, 0, 0, 1 ]\n[ 0, 0, 0, 0, 0, 0, 1, 0, 0, 0, 1, 0, 0, 1, 0, 0, 1, 0, 1, 0, 1, 0, 1, 0, 1, 0, 0, 0, 0, 1, 0, 1, 0, 1, 0, 1, 1, 0, 0, 1, 1, 1, 1, 1, 0, 1, 0, 1, 0, 1, 0, 0, 1 ]\n[ 0, 0, 0, 0, 0, 0, 0, 1, 1, 1, 1, 1, 1, 1, 0, 0, 0, 0, 0, 0, 0, 0, 0, 0, 0, 0, 0, 0, 1, 1, 1, 1, 1, 1, 1, 1, 1, 1, 1, 1, 1, 1, 0, 1, 1, 1, 1, 1, 1, 1, 0, 1, 1 ]\n[ 0, 0, 0, 0, 0, 0, 0, 0, 0, 0, 0, 0, 0, 0, 1, 1, 1, 1, 1, 1, 1, 0, 0, 0, 0, 0, 0, 0, 1, 1, 1, 1, 1, 1, 1, 0, 0, 0, 0, 0, 0, 0, 1, 1, 1, 1, 1, 1, 1, 1, 0, 1, 1 ]\n[ 0, 0, 0, 0, 0, 0, 0, 0, 0, 0, 0, 0, 0, 0, 0, 0, 0, 0, 0, 0, 0, 1, 1, 1, 1, 1, 1, 1, 1, 1, 1, 1, 1, 1, 1, 1, 1, 1, 1, 1, 1, 1, 0, 0, 0, 0, 0, 0, 0, 0, 1, 1, 1 ]"
      },
      {
        "index": 2,
        "n": 52,
        "k": 10,
        "published_d": 21,
        "verified_d": 21,
        "recipe": "Puncturing of [1] at { 53 }"
      }
    ],
    "credit": "Published construction, not a pilot discovery. Named authors retained in recipe text."
  }
}
