{
  "format": "binary-generator-v1",
  "q": 2,
  "n": 44,
  "k": 11,
  "d": 16,
  "rows": [
    "10000000000101110101010000111111111111001000",
    "01000000000110111010101000011111101111100100",
    "00100000000011011101011100001111100111110010",
    "00010000000101101110101110000111100011111001",
    "00001000000010110111011111000011110001111100",
    "00000100000101011011101111100001101000111110",
    "00000010000010101101111111110000100100011111",
    "00000001000101010110111111111000010010001111",
    "00000000100110101011010111111100011001000111",
    "00000000010111010101100011111110011100100011",
    "00000000001011101010110001111111011110010001"
  ],
  "provenance": {
    "kind": "structured-search-milestone",
    "run": "44_11_202_hill",
    "phase": "qc",
    "step": 64,
    "log": "research/c0202026102018570000000000000001/qc/44_11_202_hill.jsonl"
  }
}
