{
  "format": "binary-generator-v1",
  "q": 2,
  "n": 189,
  "k": 22,
  "d": 72,
  "rows": [
    "111111111111111111111111111111111111111111111111111111111111111111111111111111111111111111111111111111111111111111111111111111111111111111111111111111111111111111111111111111111111111111111",
    "101110010111001011100101110010111001011100101110010111001011100101110010111001011100101110010111001011100101110010111001011100101110010111001011100101110010111001011100101110010111001011100",
    "010111001011100101110010111001011100101110010111001011100101110010111001011100101110010111001011100101110010111001011100101110010111001011100101110010111001011100101110010111001011100101110",
    "001011100101110010111001011100101110010111001011100101110010111001011100101110010111001011100101110010111001011100101110010111001011100101110010111001011100101110010111001011100101110010111",
    "100001100010100111101000111001001011011101100110101011111100000111101000111001001011011101100110101011111100000100001100010100011100100101101110110011010101111110000010000110001010011110100",
    "010000110001010011110100011100100101101110110011010101111110000011110100011100100101101110110011010101111110000010000110001010001110010010110111011001101010111111000001000011000101001111010",
    "001000011000101001111010001110010010110111011001101010111111000001111010001110010010110111011001101010111111000001000011000101000111001001011011101100110101011111100000100001100010100111101",
    "000100001100010100111101000111001001011011101100110101011111100100111101000111001001011011101100110101011111100000100001100010100011100100101101110110011010101111110000010000110001010011110",
    "000010000110001010011110100011100100101101110110011010101111110010011110100011100100101101110110011010101111110000010000110001010001110010010110111011001101010111111000001000011000101001111",
    "000001000011000101001111010001110010010110111011001101010111111101001111010001110010010110111011001101010111111000001000011000101000111001001011011101100110101011111100000100001100010100111",
    "101111110010101000110011110111010110100110110001001000011100000000101111110010101000110011110111010110100110110001001000011100010110100110110001001000011100000101111110010101000110011110111",
    "010111111001010100011001111011101011010011011000100100001110000000010111111001010100011001111011101011010011011000100100001110101011010011011000100100001110000010111111001010100011001111011",
    "001011111100101010001100111101110101101001101100010010000111000000001011111100101010001100111101110101101001101100010010000111110101101001101100010010000111000001011111100101010001100111101",
    "000101111110010101000110011110111010110100110110001001000011100100000101111110010101000110011110111010110100110110001001000011111010110100110110001001000011100000101111110010101000110011110",
    "000010111111001010100011001111011101011010011011000100100001110110000010111111001010100011001111011101011010011011000100100001011101011010011011000100100001110000010111111001010100011001111",
    "000001011111100101010001100111101110101101001101100010010000111111000001011111100101010001100111101110101101001101100010010000101110101101001101100010010000111000001011111100101010001100111",
    "101001001100101100000101001001100101100000101001001100101100000011110110101011101000011110110101011101000011110110101011101000001100101100000101001001100101100000101001001100101100000101001",
    "010100100110010110000010100100110010110000010100100110010110000001111011010101110100001111011010101110100001111011010101110100100110010110000010100100110010110000010100100110010110000010100",
    "001010010011001011000001010010011001011000001010010011001011000000111101101010111010000111101101010111010000111101101010111010010011001011000001010010011001011000001010010011001011000001010",
    "000101001001100101100000101001001100101100000101001001100101100000011110110101011101000011110110101011101000011110110101011101001001100101100000101001001100101100000101001001100101100000101",
    "000010100100110010110000010100100110010110000010100100110010110100001111011010101110100001111011010101110100001111011010101110100100110010110000010100100110010110000010100100110010110000010",
    "000001010010011001011000001010010011001011000001010010011001011010000111101101010111010000111101101010111010000111101101010111010010011001011000001010010011001011000001010010011001011000001"
  ],
  "provenance": {
    "kind": "coordinate-rotated-published-parent",
    "source": "research/readiness-20261021/certificates/189_22_72.json",
    "block_rotations": [
      0,
      6,
      5
    ],
    "degree_three": 13,
    "degree_six_factors": [
      97,
      109,
      117
    ],
    "scalars": [
      15,
      14,
      8,
      34,
      6,
      60
    ],
    "seed": "4ca1557c95957c68512d1bf14dfd865c",
    "credit": "Seddas, Shashkov, Viazovska, Abbe; a normalized replication, not a new code"
  }
}
