{
  "format": "binary-generator-v1",
  "q": 2,
  "n": 52,
  "k": 10,
  "d": 20,
  "rows": [
    "1000000011001011101100011100110001011100011110111010",
    "0100010000110011011111101101110111000110100111110011",
    "0010000000111011100011010100001100110110010010100011",
    "0001000100110001100011011010010110000101011111001000",
    "0000100010110111001100000101101001101100000010001111",
    "0000010110100001111101000000001111100000001011010100",
    "0000011000000011110011110010111011101111100001010011",
    "0000000110011111111011000010101001000010100110011101",
    "0000000000110100000111111011100100011001011101111111",
    "0000000001010100011100000010111110010110001011010010"
  ],
  "provenance": {
    "kind": "timed-contributor-search",
    "method": "blind",
    "seed": 901,
    "start": "cold",
    "iterations": 914438,
    "parent": "random systematic",
    "log": "research/c0202026102018570000000000000001/heldout/52_10_cold_901_blind.jsonl",
    "source_sha256": "f7ec2ff6747084d0c188dd215dcdb30a2dbb6381ad54e6f8c12566f627ca1784",
    "credit": "Published baseline retained as provenance; no novelty inferred from matrix hash."
  }
}
