{
  "format": "binary-generator-v1",
  "q": 2,
  "n": 42,
  "k": 12,
  "d": 14,
  "rows": [
    "100100001110000010110010111000111110111000",
    "010001000100101000110000000010110111111011",
    "001100110100011101111011101111011100011000",
    "000100101000100101000001101111010010010111",
    "001010101000100000001110001110010101010100",
    "000001010000100001011000111000101110110001",
    "000000100000010000110011001000011101110100",
    "000000010000110011001110101011000001101111",
    "001100110000110011100001111111101101000110",
    "000100110100001010000011110001010001110111",
    "100100000100010001011111001110101011111011",
    "000100110001001000101111011001000011000001"
  ],
  "provenance": {
    "kind": "timed-contributor-search",
    "method": "blind",
    "seed": 103,
    "start": "cold",
    "iterations": 139113,
    "parent": "random systematic",
    "log": "research/c0202026102018570000000000000001/paired/42_12_cold_103_blind.jsonl",
    "source_sha256": "d1de91eb7a2d95666e9af9e75ee721edbd2acbeddb01b94d3582b4277f0e566f",
    "credit": "Published baseline retained as provenance; no novelty inferred from matrix hash."
  }
}
