{
  "format": "binary-generator-v1",
  "q": 2,
  "n": 44,
  "k": 11,
  "d": 16,
  "rows": [
    "10000000000111111101011110011011010010101110",
    "01000000000111111110100111001101101001010111",
    "00100000000011111111011011100110110100101011",
    "00010000000101111111101101110011011010010101",
    "00001000000010111111110110111001111101001010",
    "00000100000101011111111011011100101110100101",
    "00000010000110101111111101101110010111010010",
    "00000001000111010111110110110111001011101001",
    "00000000100111101011110011011011110101110100",
    "00000000010111110101111001101101101010111010",
    "00000000001111111010111100110110100101011101"
  ],
  "provenance": {
    "kind": "qc-structured-search",
    "seed": 201,
    "method": "anneal",
    "source_sha256": "e62b691f6b4b3977855b272c938d274fc503ab753bbc3013f03e996734e7122c",
    "iterations": 3683573,
    "parent": "four binary circulants, first identity, block size11",
    "parameters": {
      "polynomials": [
        1,
        1407,
        871,
        937
      ]
    }
  }
}
