{
  "format": "binary-generator-v1",
  "q": 2,
  "n": 62,
  "k": 10,
  "d": 26,
  "rows": [
    "00000000010010000011110001110111101110101010011110010001011111",
    "00000000100100000111100011101111011101010100111100100010111110",
    "00000001001000001111000111011110111010101001111001000101111100",
    "00000010010000011110001110111101110101010011110010001011111000",
    "00000100100000111100011101111011101010100111100100010111110000",
    "00001001000001111000111011110111010101001111001000101111100000",
    "00010010000011110001110111101110101010011110010001011111000000",
    "00100100000111100011101111011101010100111100100010111110000000",
    "01001000001111000111011110111010101001111001000101111100000000",
    "10010000011110001110111101110101010011110010001011111000000000"
  ],
  "provenance": {
    "kind": "published-reconstruction",
    "url": "https://www.codetables.de/BKLC/BKLC.php?q=2&n=62&k=10",
    "snapshot": "data/sources/62_10.html",
    "snapshot_sha256": "4e8e39a605401a4cae245661b2f90fdc84b9a94c6e9c67c95db6b210f6a9e1f6",
    "steps": [
      {
        "index": 1,
        "n": 63,
        "k": 11,
        "published_d": 26,
        "verified_d": 26,
        "recipe": "BCHCode with parameters 63 18 48"
      },
      {
        "index": 2,
        "n": 62,
        "k": 10,
        "published_d": 26,
        "verified_d": 26,
        "recipe": "Shortening of [1] at { 63 }"
      }
    ],
    "credit": "Published construction, not a pilot discovery. Named authors retained in recipe text."
  }
}
