{
  "format": "binary-generator-v1",
  "q": 2,
  "n": 189,
  "k": 4,
  "d": 84,
  "rows": [
    "111111111111111111111111111111111111111111111111111111111111111000000000000000000000000000000000000000000000000000000000000000111111111111111111111111111111111111111111111111111111111111111",
    "000000000000000000000000000000000000000000000000000000000000000111111111111111111111111111111111111111111111111111111111111111111111111111111111111111111111111111111111111111111111111111111",
    "110110110110110110110110110110110110110110110110110110110110110110110110110110110110110110110110110110110110110110110110110110110110110110110110110110110110110110110110110110110110110110110",
    "011011011011011011011011011011011011011011011011011011011011011011011011011011011011011011011011011011011011011011011011011011011011011011011011011011011011011011011011011011011011011011011"
  ],
  "provenance": {
    "kind": "CPU-enumerator-control",
    "name": "low-C"
  }
}
