{
  "format": "binary-generator-v1",
  "q": 2,
  "n": 189,
  "k": 16,
  "d": 74,
  "rows": [
    "110110110110110110110110110110110110110110110110110110110110110000000000000000000000000000000000000000000000000000000000000000110110110110110110110110110110110110110110110110110110110110110",
    "011011011011011011011011011011011011011011011011011011011011011000000000000000000000000000000000000000000000000000000000000000011011011011011011011011011011011011011011011011011011011011011",
    "000000000000000000000000000000000000000000000000000000000000000110110110110110110110110110110110110110110110110110110110110110110110110110110110110110110110110110110110110110110110110110110",
    "000000000000000000000000000000000000000000000000000000000000000011011011011011011011011011011011011011011011011011011011011011011011011011011011011011011011011011011011011011011011011011011",
    "110111001100011101011111101101000100001011001010100100111100000110111001100011101011111101101000100001011001010100100111100000000110111001100011101011111101101000100001011001010100100111100",
    "011011100110001110101111110110100010000101100101010010011110000011011100110001110101111110110100010000101100101010010011110000000011011100110001110101111110110100010000101100101010010011110",
    "001101110011000111010111111011010001000010110010101001001111000001101110011000111010111111011010001000010110010101001001111000000001101110011000111010111111011010001000010110010101001001111",
    "000110111001100011101011111101101000100001011001010100100111100000110111001100011101011111101101000100001011001010100100111100100000110111001100011101011111101101000100001011001010100100111",
    "000011011100110001110101111110110100010000101100101010010011110000011011100110001110101111110110100010000101100101010010011110110000011011100110001110101111110110100010000101100101010010011",
    "000001101110011000111010111111011010001000010110010101001001111000001101110011000111010111111011010001000010110010101001001111111000001101110011000111010111111011010001000010110010101001001",
    "111100100101010011010000100010110111111010111000110011101100000111100100101010011010000100010110111111010111000110011101100000111100100101010011010000100010110111111010111000110011101100000",
    "011110010010101001101000010001011011111101011100011001110110000011110010010101001101000010001011011111101011100011001110110000011110010010101001101000010001011011111101011100011001110110000",
    "001111001001010100110100001000101101111110101110001100111011000001111001001010100110100001000101101111110101110001100111011000001111001001010100110100001000101101111110101110001100111011000",
    "000111100100101010011010000100010110111111010111000110011101100000111100100101010011010000100010110111111010111000110011101100000111100100101010011010000100010110111111010111000110011101100",
    "000011110010010101001101000010001011011111101011100011001110110000011110010010101001101000010001011011111101011100011001110110000011110010010101001101000010001011011111101011100011001110110",
    "000001111001001010100110100001000101101111110101110001100111011000001111001001010100110100001000101101111110101110001100111011000001111001001010100110100001000101101111110101110001100111011"
  ],
  "provenance": {
    "kind": "pair-threshold-pricing",
    "profile": "B",
    "factors": [
      103,
      115
    ],
    "f_pair": 65,
    "g_pair": 72,
    "seed": "4ca1557c95957c68512d1bf14dfd865c",
    "base": "76267c387538b4fb0e802278530b575bab4d1f76",
    "model_credit": "PR #12, same author session; canonical B/C low constituents",
    "claim": "Rank-16 subcode only; not a full dimension-22 construction or record."
  }
}
