{
  "format": "binary-generator-v1",
  "q": 2,
  "n": 172,
  "k": 21,
  "d": 58,
  "rows": [
    "1100010001101101011001001011000001110010101000111000011100001111100000000000000000000101000100001010010001101001111010000000010011100100010000011100001000000010000100001011",
    "0110001000110110101100100101100000111001010100011100001110000111110000000000000000000010100010000101001000110100111101000000001001110010001000001110000100000001000010000111",
    "0011000100011011010110010010110000011100101010001110000111000011111000000000000000000101010001000010100100011010011110100000000100111001000100000111000010000000100001000011",
    "0001100010001101101011001001011000001110010101000111000011100001111100000000000000000010101000100001010010001101001111010000000010011100100010000011100001000000010000100011",
    "0000110001000110110101100100101100000111001010100011100001110000111110000000000000000001010100010000101001000110100111101000000001001110010001000001110000100000001000010011",
    "0000011000100011011010110010010110000011100101010001110000111000011111000000000000000000101010001000010100100011010011110100000000100111001000100000111000010000000100001011",
    "0000001100010001101101011001001011000001110010101000111000011100001111100000000000000000010101000100001010010001101001111010000000010011100100010000011100001000000010000111",
    "0000000110001000110110101100100101100000111001010100011100001110000111110000000000000100001010100010000101001000110100111101000000001001110010001000001110000100000001000011",
    "0000000011000100011011010110010010110000011100101010001110000111000011111000000000000010000101010001000010100100011010011110100000000100111001000100000111000010000000100011",
    "0000000001100010001101101011001001011000001110010101000111000011100001111100000000000001000010101000100001010010001101001111010000000010011100100010000011100001000000010011",
    "0000000000110001000110110101100100101100000111001010100011100001110000111110000000000000100001010100010000101001000110100111101000000001001110010001000001110000100000001011",
    "0000000000011000100011011010110010010110000011100101010001110000111000011111000000000000010000101010001000010100100011010011110100000000100111001000100000111000010000000111",
    "0000000000001100010001101101011001001011000001110010101000111000011100001111100000000100001000010101000100001010010001101001111010000000010011100100010000011100001000000011",
    "0000000000000110001000110110101100100101100000111001010100011100001110000111110000000010000100001010100010000101001000110100111101000000001001110010001000001110000100000011",
    "0000000000000011000100011011010110010010110000011100101010001110000111000011111000000001000010000101010001000010100100011010011110100000000100111001000100000111000010000011",
    "0000000000000001100010001101101011001001011000001110010101000111000011100001111100000000100001000010101000100001010010001101001111010000000010011100100010000011100001000011",
    "0000000000000000110001000110110101100100101100000111001010100011100001110000111110000000010000100001010100010000101001000110100111101000000001001110010001000001110000100011",
    "0000000000000000011000100011011010110010010110000011100101010001110000111000011111000000001000010000101010001000010100100011010011110100000000100111001000100000111000010011",
    "0000000000000000001100010001101101011001001011000001110010101000111000011100001111100000000100001000010101000100001010010001101001111010000000010011100100010000011100001011",
    "0000000000000000000110001000110110101100100101100000111001010100011100001110000111110000000010000100001010100010000101001000110100111101000000001001110010001000001110000111",
    "0000000000000000000011000100011011010110010010110000011100101010001110000111000011111100000001000010000101010001000010100100011010011110100000000100111001000100000111000011"
  ],
  "provenance": {
    "kind": "single-factor-swap-matrix-control",
    "seed": "4ca1557c95957c68512d1bf14dfd865c",
    "base": "76267c387538b4fb0e802278530b575bab4d1f76",
    "construction": [
      172,
      21,
      58,
      85,
      [
        [
          1,
          0
        ],
        [
          4,
          3,
          2,
          1,
          0
        ],
        [
          0,
          1,
          3,
          4,
          5,
          6,
          8
        ],
        [
          0,
          2,
          3,
          4,
          6,
          7,
          8
        ]
      ],
      [
        [
          0
        ],
        [
          0,
          1,
          5,
          6,
          7,
          8,
          10,
          18,
          19
        ]
      ],
      [
        "11111",
        "11111"
      ]
    ],
    "selection": "First rejection with largest saved witness weight; not a claimed best code",
    "parent": "research/readiness-20261021/certificates/172_21_66.json",
    "source": "https://arxiv.org/html/2609.37056v1",
    "authors_of_inherited_construction": "Seddas, Shashkov, Viazovska, Abbe"
  }
}
