{
  "format": "binary-generator-v1",
  "q": 2,
  "n": 62,
  "k": 11,
  "d": 24,
  "rows": [
    "11000001010011111010010101100110001010100110000111010000100100",
    "01101100010100110011110110101011110010100011010101001101001111",
    "00000001010001001000011111110000100001111011111101110110100001",
    "01000011101111100011111100110101000111100111100111101100011100",
    "00110011010000000010101000101010011010010000100101111111111000",
    "01110010010011010111101010111101111101011000100110100100101010",
    "00100001000100111001010101110111101001001111101110111110001111",
    "01000110011111010010010101001010000010110011101000011100011110",
    "00011111001000010000000010110010101111100111101001110100001100",
    "00100111110101010000001011100011011110011111101110000101101110",
    "00100111100100000010101111111111110000011001011110100110010001"
  ],
  "provenance": {
    "kind": "timed-contributor-search",
    "method": "walsh",
    "seed": 102,
    "start": "cold",
    "iterations": 48952,
    "parent": "random systematic",
    "log": "research/c0202026102018570000000000000001/paired/62_11_cold_102_walsh.jsonl",
    "source_sha256": "d1de91eb7a2d95666e9af9e75ee721edbd2acbeddb01b94d3582b4277f0e566f",
    "credit": "Published baseline retained as provenance; no novelty inferred from matrix hash."
  }
}
