{
  "format": "binary-generator-v1",
  "q": 2,
  "n": 189,
  "k": 22,
  "d": 72,
  "rows": [
    "110010010100000011001001100001111010101011000000000000000000000111001011000110100111110011001001011011010100111101100010000000101011000100010111011010101000001011001010111011011001111100000",
    "011001001010000001100100110000111101010101100000000000000000000011100101100011010011111001100100101101101010011110110001000000010101100010001011101101010100000101100101011101101100111110000",
    "001100100101000000110010011000011110101010110000000000000000000001110010110001101001111100110010010110110101001111011000100000001010110001000101110110101010000010110010101110110110011111000",
    "000110010010100000011001001100001111010101011000000000000000000000111001011000110100111110011001001011011010100111101100010000000101011000100010111011010101000001011001010111011011001111100",
    "000011001001010000001100100110000111101010101100000000000000000000011100101100011010011111001100100101101101010011110110001000000010101100010001011101101010100000101100101011101101100111110",
    "000001100100101000000110010011000011110101010110000000000000000000001110010110001101001111100110010010110110101001111011000100000001010110001000101110110101010000010110010101110110110011111",
    "000000110010010100000011001001100001111010101011000000000000000000000111001011000110100111110011001001011011010100111101100010100000101011000100010111011010101000001011001010111011011001111",
    "000000011001001010000001100100110000111101010101100000000000000000000011100101100011010011111001100100101101101010011110110001110000010101100010001011101101010100000101100101011101101100111",
    "000000001100100101000000110010011000011110101010110000000000000100000001110010110001101001111100110010010110110101001111011000111000001010110001000101110110101010000010110010101110110110011",
    "000000000110010010100000011001001100001111010101011000000000000010000000111001011000110100111110011001001011011010100111101100111100000101011000100010111011010101000001011001010111011011001",
    "000000000011001001010000001100100110000111101010101100000000000001000000011100101100011010011111001100100101101101010011110110111110000010101100010001011101101010100000101100101011101101100",
    "000000000001100100101000000110010011000011110101010110000000000000100000001110010110001101001111100110010010110110101001111011011111000001010110001000101110110101010000010110010101110110110",
    "000000000000110010010100000011001001100001111010101011000000000100010000000111001011000110100111110011001001011011010100111101001111100000101011000100010111011010101000001011001010111011011",
    "000000000000011001001010000001100100110000111101010101100000000110001000000011100101100011010011111001100100101101101010011110100111110000010101100010001011101101010100000101100101011101101",
    "000000000000001100100101000000110010011000011110101010110000000011000100000001110010110001101001111100110010010110110101001111110011111000001010110001000101110110101010000010110010101110110",
    "000000000000000110010010100000011001001100001111010101011000000101100010000000111001011000110100111110011001001011011010100111011001111100000101011000100010111011010101000001011001010111011",
    "000000000000000011001001010000001100100110000111101010101100000110110001000000011100101100011010011111001100100101101101010011101100111110000010101100010001011101101010100000101100101011101",
    "000000000000000001100100101000000110010011000011110101010110000111011000100000001110010110001101001111100110010010110110101001110110011111000001010110001000101110110101010000010110010101110",
    "000000000000000000110010010100000011001001100001111010101011000111101100010000000111001011000110100111110011001001011011010100011011001111100000101011000100010111011010101000001011001010111",
    "000000000000000000011001001010000001100100110000111101010101100011110110001000000011100101100011010011111001100100101101101010101101100111110000010101100010001011101101010100000101100101011",
    "000000000000000000001100100101000000110010011000011110101010110001111011000100000001110010110001101001111100110010010110110101110110110011111000001010110001000101110110101010000010110010101",
    "000000000000000000000110010010100000011001001100001111010101011100111101100010000000111001011000110100111110011001001011011010111011011001111100000101011000100010111011010101000001011001010"
  ],
  "provenance": {
    "kind": "compatibility-kernel-control",
    "name": "published-parent",
    "parent_credit": "Seddas, Shashkov, Viazovska, Abbe"
  }
}
