{
  "format": "binary-generator-v1",
  "q": 2,
  "n": 62,
  "k": 11,
  "d": 25,
  "rows": [
    "00000000010010000011110001110111101110101010011110010001011111",
    "00000000100100000111100011101111011101010100111100100010111110",
    "00000001001000001111000111011110111010101001111001000101111100",
    "00000010010000011110001110111101110101010011110010001011111000",
    "00000100100000111100011101111011101010100111100100010111110000",
    "00001001000001111000111011110111010101001111001000101111100000",
    "00010010000011110001110111101110101010011110010001011111000000",
    "00100100000111100011101111011101010100111100100010111110000000",
    "01001000001111000111011110111010101001111001000101111100000000",
    "10010000011110001110111101110101010011110010001011111000000000",
    "00100000111100011101111011101010100111100100010111110000000000"
  ],
  "provenance": {
    "kind": "structured-search-milestone",
    "run": "62_11_403_anneal",
    "phase": "coset",
    "step": 0,
    "log": "research/c0202026102018570000000000000001/coset/62_11_403_anneal.jsonl"
  }
}
